20455,EK TO MERA MASTANA ,GORA AUR KALA ,LATA MANGESHKAR 
20456,EXCUSE ME ,STYLE ,NITIN RAIKWAR,NISHI 
20457,FAASLE HAIN BAHUT ,FAASLE ,ASHA BHOSLE 
20458,GAATA RAHE MERA DIL ,GUIDE ,LATA, KISHORE KUMAR 
20459,GAAYE JA GEET MILAN KE ,MELA(1948) ,MUKESH 
20460,GADI DHERE HAANK RE ,MOTHER INDIA ,SHAMSHAD BEGUM MOHD. RAFI 
20461,GAIRON PE KARAM ,AANKHEN ,LATA MANGESHKAR 
20462,GALI GALI SHOR ,AAR PAAR ,KISHORE KUMAR 
20463,GALI MEIN AAJ CHAAND NIKLA ,ZAKHM ,ALKA YAGNIK 
20464,GAM KA FASANA ,MANCHALI ,KISHOR KUMAR 
20465,GANGA MAIYYA MEIN ,CHANDAN KA PALNA ,LATA MANGESHKAR 
20466,GAPOOCHI GAPOOCHI GUM GUM ,TRISHUL ,LATA, NITIN MUKESH 
20467,GAR TUM BHOOLA NA DOGE ,YAKEEN ,MOHD. RAFI 
20468,GARAJ BARAS SAWAN ,PAAP ,ALIAZAMAT 
20469,GAWAH HAI CHAND TAARE GAWAH HAI ,DAAMINI ,ALKA YAGNIK, KUMAR SANU 
20470,GAYA BACHPAN ,AANKHON ANKHON MEIN ,LATA MANGESHKAR 
20471,GE GELI ZARA TIMBAK TOO ,JHUMROO ,KISHORE KUMAR 
20472,GEET GAATA CHAL 0 SAATHI ,GEET GATA CHAL ,JASPAL SINGH 
20473,GEET GAATA HOON MAIN ,LAL PATTHAR ,KISHORE KUMAR 
20474,GEET GAAYA PATTHARON NE ,GEET GAAYA PATHARON NE ,ASHA.MAHENDRA KAPOOR 
20475,GHAR AAJA PARDESI ,DILWALE DULHANIA LE JAYENGE ,PAMELA.MANPREET 
20476,GHAR AAYA MERA PARDESI ,AAWARA ,LATA MANGESHKAR 
20477,GHAR JAYEGI TAR JAYEGI ,KHUSHBOO ,ASHA BHOSLE 
20478,GHUNGAROON KI TARAH ,CHOR MACHAAYE SHOR ,KISHOR KUMAR 
20479,GOLMAAL HAI BHAI ,GOLMAAL ,R.D. BURMAN, SAPAN C. 
20480,GORE GORE ,SAMAADHI ,LATA MANGESHKAR, AMIR BAAI 
20481,GORE HAATHON PAR NA ,PYAAR KIYE JAA ,MOHD. RAFI 
20482,GORI HO KALI HO ,BIWI 0 BIWI ,KISHORE KUMAR 
20483,GORI KE HAATH MAIN ,MELA (1971) ,LATA MANGESHKAR, MOHD.RAFI 
20484,GORI TERA GAAON BADA ,CHITCHOR ,K.J. YSUDAS 
20485,GORIYA RE GORIYA RE ,AAINA ,LATA, JOLLY MUKHARJEE 
20486,GORON KI NA KAALON KI ,DISCO DANCER ,SURESH WADKAR 
20487,GULAABI GULAABI AANKHON SE ,BANPHOOL ,MOHD. RAFI 
20488,GUM HAI KISI KE ,RAMPUR KA LAXMAN ,LATA, KISHORE KUMAR 
20489,GUMNAAM HAIN KOI ,GUMNAAM ,LATA MANGESHKAR 
20490,GUN GUN KARTA AAYA ,MUSKURAHAT ,SADHANA,KUMAR SANU 
20491,GUNGUNA RAHE HAIN ,AARADHANA ,ASHA BHOSLE, MOHD. RAFI 
20492,GUNI JANO BHAKT JANO ,AANSOON AUR MUSKAAN ,KISHORE KUMAR 
20493,HA DEEWANA HOON MAIN ,SARANGA ,MUKESH 
20494,HAAL KAISA HAI JANAAB KA ,CHALTI KA NAAM GAADI ,ASHA BHOSLE, KISHORE KUMAR 
20495,HAAL KYA HAI DILON KA ,ANOKHI ADAA ,KISHORE KUMAR 
20496,HAAN MERA DEEWAANAPAN ,DEEWANAPAN ,SHAAN,SUNIDHI 
20497,HAATH AAYA HAI JABSE ,DIL AUR MOHABBAT ,ASHA,MAHENDRA 
20498,HAAY MOHABBAT ,HERO ,LATA,SURESH WADKAR 
20499,HAAY RE NA MARO ,GARAM MASALA ,ASHA BHOSLE 
20500,HAAYE RE HAAYE ,HUMJOLI ,LATA,MOHD. RAFI 
20501,HAI APNA DIL TO AAWAARA ,SOLWAAH SAAL ,HEMANT KUMAR 
20502,HAII ISI MEIN PYAAR KIAABRU ,ANPADH ,LATA MANGESHKAR 
20503,HAMEN TUMSE PYAR KITNA ,KUDARAT ,KISHORE KUMAR 
20504,HANSTA HUA NOORANI ,PAARASMANI ,LATA MANGESHKAR, KAMAAL 
20505,HAR CHEHRA YAHAAN CHAAND ,AABROO ,MOHD. RAFI 
20506,HARI OM HARI ,PYAARA DUSHMAN ,USHA UTTHUP 
20507,HASEENON SE MOHABBAT KA ,ALBELA ,CHITALKAR 
20508,HAWA CHALE KAISE ,DAAG(1973) ,LATA MANGESHKAR 
20509,HAWA KE SAATH SAATH ,SEETA AL GEETA ,KISHORE, ASHA 
20510,HAWA MEIN UDTA JAAYE ,BARSAAT ,LATA MANGESHKAR 
20511,HAYE DIL KI BAAZI LAGA ,ONE KA 4 ,ALKA,SONU NIGAM 
20512,HAZAAR RAAHEN MUD KE ,THODI SI BEWAFAI ,LATA,KISHORE KUMAR 
20513,HELLO HELLO ,JHOOTA HI SAHI ,KARTHIK 
20514,HEY BABA HEY BABA ,MANZIL MANZIL ,ASHA BHOSLE 
20515,HEY BABA RE BABA ,JEEVAN EK SANGHURSH ,AMIT KUMAR,KAVITA 
20516,HMM HUMNE TUMKO DEKHA ,KHEL KHEL MEIN ,SHAILENDERA SINGH 
20517,HO GAYA HAI TUJHKO TO ,DILWALE DULHANIYA LE JAAYENGE ,LATA, UDIT NARAYAN 
20518,HO KE MAJBOOR MUJHE ,HAQEEQAT ,RAFI,MANNA DEY.TALAT.M 
20519,HOLI. AAYI RE ,MASHAAL ,LATA,KISHORE KUMAR 
20520,HOTHON PE BEETI BAAT ,ANGOOR ,ASHA BHOSLE 
20521,HOTON PE JAAN CHALI JAYEGI ,PATITA ,KISHORE KUMAR 
20522,HUE HAIN TUMPE AASHIQ ,MERE SANAM ,MOHD. RAFI 
20523,HUM AAJ KAHIN DIL ,ANDAAZ ,MUKESH 
20524,HUM AAPKE HAIN KAUN ,HUM AAPKE HAIN KAUN ,LATA MANGESHKAR, S.P.B 
20525,HUM AAPKI AANKHON MEIN ,PYAASA ,GEETA DUTT, MOHD. RAFI 
20526,HUM APNI TARAF SE ,ANSH ,ALKA.KUMAR SANU 
20527,HUM AUR TUM ,DAAG(1973) ,KISHORE KUMAR, LATA 
20528,HUM BANE TUM BANE ,EK DUJE KE LIYE ,LATA, S.P.BALA'M 
20529,HUM BEKHUDI MEIN ,KAALA PAANI ,MOHD. RAFI 
20530,HUM BHI TUM BHI CHOR HAI SAATHI ,CHOR CHOR ,UDIT NARAYAN, MAANO 
20531,HUM BOLEGA TO BOLOGE KI BOLTA HAI ,KASAUTI ,KISHORE KUMAR 
20532,HUM DONO DO PREMI ,AJNABI ,LATA, KISHORE KUMAR 
20533,HUM DONO JAISA ,MERE YAAR KI SHAADI HAI ,KK,SUNIDHI CHAUHAN 
20534,HUM HAIN MATAY E KOOCHA ,DASTAK(1970) ,LATA MANGESHKAR 
20535,HUM HAIN RAHI PYAAR KE ,NAU DO GYARAH ,KISHORE KUMAR 
20536,HUM IK DOOJE KE DEEWANE ,PHOOL ,KUMAR SANU 
20537,HUM INTZAR KARENGE ,BAHU BEGAM ,MOHD. RAFI 
20538,HUM KALE HAIN TO ,GUMNAAM ,MOHD. RAFI 
20539,HUM KO BHI GAM NE MAARA ,AAS PAAS ,LATA MANGESHKAR 
20540,HUM LAAYE HAI TOOFAN ,JAGRITI ,MOHD. RAFI 
20541,HUM NAHIN JHOOMTE ,JAANI DOST ,KISHORE KUMAR,ASHA 
20542,HUM PANCHHI MASTANE ,DEKH KABIRAA ROYA ,GEETA DUTT, LATA, SEETA A. 
20543,HUM PREMI PREM KARNA JAANE ,PARVARISH ,KISHORE, MOHD. RAFI,AMIT 
20544,HUM PYAAR MEIN JALNEWALON KO ,JAILOR ,LATA MANGESHKAR 
20545,HUM SATH SATH HAI ,HUM SATH SATH HAI ,HARIHARAN, ,ANURADHA, KAVITA,UDIT 
20546,HUM SE RAHOGE ,AUR PYAR HO GAYA ,SONU NIGAM 
20547,HUM THE JINKE SAHARE ,SAFAR ,LATA MANGESHKAR 
20548,HUM THE WOH THI AUR SAMA ,CHALTI KA NAAM GAADI ,KISHORE KUMAR 
20549,HUM TO CHALE PARDES ,SARGAM(1979) ,MOHD. RAFI 
20550,HUM TO MOHABBAT KAREGA ,DILLI KA THUG ,KISHORE KUMAR 
20551,HUM TOH TERE AASHIQ HAIN ,FARZ ,MUKESH 
20552,HUM TUM DONO JAB ,EK DUJE KE LIYE ,LATA,S.P.B. 
20553,HUM TUM DONO MIL KE ,LAAVA ,LATA.KISHORE KUMAR 
20554,HUM TUM EK KAMRE MEIN ,BOBBY ,SHAILENDRA, LATA 
20555,HUM TUM SE JUDA HO KE ,EK SAPERA EK LOOTERA ,MOHD. RAFI 
20556,HUM TUM YUG YUG SE ,MILAN ,LATA MANGESHKAR, MUKESH 
20557,HUM TUMHARE LIYE ,INTAQAM ,LATA,MOHD. RAFI 
20558,HUM TUMSE MOHABBAT KARKE SANAM ,AAWAARA ,MUKESH 
20559,HUM YAHAAN TUM WAHAAN ,ZAKHM ,ALKA YAGNIK 
20560,HUMBA LEELA ,HERA PHERA ,ABHIJEET,VINOD 
20561,HUMEN AUR JEENE KI CHAHAT NA HOTI ,AGAR TUM IA HOTE ,KISHORE KUMAR 
20562,HUMKO AAJKAL HAI ,SAILAAB ,ANUPAMA DESHPANDE 
20563,HUMKO HONE DO SHARABI ,KOI KISISE KUM NAHIN ,KUMAR SANU,ABHIJEET 
20564,HUMKO MANN KI ,GUDDI ,VAANI JAIRAM 
20565,HUMKO TO YAARA TERI YAARI ,HUM KISISE KAM NAHIN ,ASHA,KISHORE KUMAR 
20566,HUMNE TUJHKO PYAR ,DULHA DULHAN ,MUKESH 
20567,HUSN HAAZIR HAI ,LAILA MAJNU ,LATA MANGESHKAR 
20568,HUSN PAHADO KA ,RAM TERI GANGA MAILEE ,LATA, SURESH WADKAR 
20569,HUZ0OR IS KADAR BHI NA ,MAASUM ,BHUPINDER, SURESH WADKAR 
20570,HUZOORE WALA ,YEH RAAT PHIR NA AAYEGI ,ASHA, USHA 
20571,IAMA BACHELOR ,HIMALAY PUTRA ,VINOD RATHOD 
20572,IAMA DISCO DANCER ,DISCO DANCER ,VIJAY BENEDICT 
20573,IBTEDA E ISHQ MEIN HUM ,HARIYALI AUR RASTA ,LATA,MUKESH 
20574,ICHAK DANA ,SHREE 420 ,LATA MANGESHKAR, MUKESH 
20575,IJAZAT HO ,AADMIAUR INSAAN ,ASHA.MAHENDRA KAPOOR 
20576,IK PAL KA JEENA ,KAHO NA PYAAR HAI ,LUCKY ALI 
20577,IK PARDESI MERA ,PHAAGUN ,ASHA BHOSLE, MOHD. RAFI 
20578,IK RAASTA HAI ZINDAGI ,KAALA PATTHAR ,KISHORE, LATA 
20579,ILU ILU ILU ILU ,SAUDAGAR 1991 ,MANHAR UDHAS ALKA.Y 
20580,IMALEE KA BOOTA BERI KA PED ,SAUDAGAR ,MOHD. AZIZ. SUDESH BHOSLE 
20581,IN AANKHON KI MASTI KE ,UMRAO JAAN ,ASHA BHOSLE 
20582,IN HAWAON MEIN ,GUMRAAH ,ASHA JI, MAHENDRA KAPOOR 
20583,INHI LOGON NE ,PAAKIZAH ,LATA MANGESHKAR 
20584,INSAAF KA MANDIR ,AMAR ,MOHD. RAFI 
20585,INSAAF KI DAGAR PE ,GANGA YAMUNA ,HEMANT KUMAR 
20586,INTEHAA HO GAYI ,SHARAABI ,KISHORE KUMAR ASHA BHOSLE 
20587,INTEZAAR ,PAAP ,ANURADHA PAUDWAL 
20588,IS MOD SE JAATE HAIN ,AANDHI ,LATA MANGESHKAR 
20589,IS NADI KO MERA ,CHASHME BUDDOOR ,SHAILENDRA,HAIMANTI 
20590,ISHAARON ISHAARON MEIN ,KASHMIR KI KALI ,ASHA, MOHD. RAFI 
20591,ISHQ BHALA KYA HAI ,KUDRAT(1998) ,VINOD RATHOD,ALKA 
20592,ISHQ KA RUTBA ,KARTOOS ,NUSRAT FATEHALI KHAN 
20593,ISHQ KI MAIN BIMAR ,DHARTI ,LATA MANGESHKAR 
20594,ISHQ PAR ZOR NAHIN ,ISHQ PAR ZOR NAHIN ,LATA MANGESHKAR 
20595,ISHWAR ALLAH TERE NAAM ,NAYA RAASTA ,MOHD. RAFI 
20596,ITNA NA MUJHSE TU ,CHHAYA ,TALAT MEHMOOD 
20597,ITNA TO YAAD HAI MUJHE ,MEHBOOB KI MEHNDI ,LATA,MOHD. RAFI