20001,AAAA BHI JA ,TEESRI KASAM ,LATA MANGESHKAR 
20002,AA AB LAUT CHALE ,JIS DESH MEIN GANGA BEHTI HAI ,MUKESH, LATA 
20003,AA CHAL KE TUJHE ,DOOR GAGAN KI CHHAON MEIN ,KISHOE KUMAR 
20004,AA DIL SE DIL MILA LE ,NAVRANG ,ASHA BHOSLE 
20005,AA GALE LAG JA ,APRIL FOOL ,MOHD. RAFI 
20006,AA JAANEJAAN ,INTEQAM ,LATA MANGESHKAR 
20007,AA JAO TADAPTE HAI ,AAWAARA ,LATA MANGESHKAR 
20008,AA MERE HUMJOLI AA ,JEENE KI RAAH ,LATA, MOHD. RAFI 
20009,AA MERI JAAN ,CHANDNI ,LATA MANGESHKAR 
20010,AADAMI ZINDAGI ,VISHWATMA ,MOHD. AZIZ 
20011,AADHA HAI CHANDRAMA ,NAVRANG ,MAHENDRA & ASHA BHOSLE 
20012,AADMI MUSAFIR HAI ,APNAPAN ,LATA, MOHD. RAFI 
20013,AAGE BHI JAANE NATU ,WAQT ,ASHA BHOSLE 
20014,AAH KO CHAHIYE ,MIRZA GAALIB ,JAGJEET SINGH 
20015,AAHA AYEE MILAN KI BELA ,AYEE MILAN KI BELA ,ASHA, MOHD. RAFI 
20016,AALAALYA SOOKU SOOKU ,JUNGLEE ,MOHD. RAFI 
20017,AAINA BATA KAISE ,MOHABBAT ,SONU NIGAM, VINOD 
20018,AAJ HAI DO OCTOBER KA DIN ,PARIVAR ,LATA MANGESHKAR 
20019,AAJ KAL PAANV ZAMEEN PAR ,GHAR ,LATA MANGESHKAR 
20020,AAJ KI RAAT PIYA ,BAAZI ,GEETA DUTT 
20021,AAJ KI SHAAM ,TAWAIF ,ASHA BHOSLE 
20022,AAJ MADAHOSH HUA JAAYE RE ,SHARMILEE ,LATA, KISHORE 
20023,AAJ MAIN JAWAAN HO GAYI HOON ,MAIN SUNDAR HOON ,LATA MANGESHKAR 
20024,AAJ MAUSAM BADA BEIMAAN HAI ,LOAFER ,MOHD. RAFI 
20025,AAJ MERE MAAN MAIN SAKHI ,AAN ,LATA MANGESHKAR 
20026,AAJ MERE YAAR KI SHAADI HAI ,AADMI SADAK KA ,MOHD.RAFI 
20027,AAJ NA CHHODENGE ,KATI PATANG ,KISHORE KUMAR, LATA 
20028,AAJ PHIR JEENE KI ,GUIDE ,LATA MANGESHKAR 
20029,AAJ PURANI RAAHON SE ,AADMI ,MOHD. RAFI 
20030,AAJ RAAT CHANDNI ,KAL KI AWAZ ,KUMAR SANU,SADHANA 
20031,AAJ RAAT HAI JAWAN ,BHAI BHAI(1970) ,ASHA BHOSLE 
20032,AAJ SE PEHLE ,CHITCHOR ,K.J. YESUDAS 
20033,AAJ SOCHA TO ,HANSTE ZAKHM ,LATA MANGESHKAR 
20034,AAJ TERE NAINA MILKE ,EHSAAN ,MOHD. RAFI,ASHA 
20035,AAJA AAJA MAIN HOON ,TEESRI MANZIL ,MOHD.RAFI,ASHA 
20036,AAJA GUFAAON MEIN AA ,AKS ,VASUNDHARA DAS, K.K 
20037,AAJA KE INTEZAR ME ,HALAAK00 ,LATA MANGESHKAR, MOHD.RA 
20038,AAJA MERI BARBAAD MOHABBAT ,ANMOL GHADI ,NOOR JEHAN 
20039,AAJA PANCHHI AKELAI HAI ,NAU DO GYARAH ,MOHD. RAFI, ASHA 
20040,AAJA RE ,AAH ,LATA MANGESHKAR & MUKESH 
20041,AAJA RE AA ZARA AA ,LOVE IN TOKYO ,MOHD. RAFI 
20042,AAJA RE 0 MERE ,NOORI ,LATA, NITIN MUKESH 
20043,AAJA RE PYAAR PUKAARE ,DIL NE PHIR YAAD KIYA ,LATA MANGESHKAR 
20044,AAJA SHAAM HONE AAYI ,MAINE PYAAR KIYA ,LATA MANGESHKAR & S.P.B. 
20045,AAJAA SANAM MADHUR CHANDNI MEIN HUM ,CHORI CHORI ,LATA MANGESHKAR, MANNA DEY 
20046,AAJKAL TERE MERE PYAR KE ,BRAMHACHARI ,SUMAN KALYANPUR, MOHD.RAFI 
20047,AAKE SEEDHI LAGI DIL PE ,HALF TICKET ,KISHORE KUMAR 
20048,AAKHON AAKHON MEIN BAAT HONE DO ,MEHEL ,ASHA BHOSLE & KISHOR KUMAR 
20049,AAKHON MAI KYA JI ,NAU DO GYARAH ,ASHA BHOSLE.KISHORE KUMAR 
20050,AAKHON SE JO UTRI HAI DIL MAIN ,PHIR WAHI DIL LAYA HOON ,ASHA BHOSLE 
20051,AALI RE AALIRE HOLI ,ZAKHMEE(1975) ,KISHORE KUMAR 
20052,AALI RE SAALI RE ,ONE KILLED JESSICA ,SONU KAKKAR,ANUSHKA 
20053,AAN MILO SAJNA ,AAN MILO SAJNA ,LATA MANGESHKAR, MOHD.RAFI 
20054,AANE SE USKE AAYE BAHAAR ,JEENE KI RAAH ,MOHD. RAFI & BHUPINDER 
20055,AANEWALA PAL ,GOLMAAL ,KISHORE KUMAR 
20056,AANKHON MEIN HAI KYA ,VISHWATMA ,MO.AZIZ,UDIT,ALKA 
20057,AANKHON MEIN QAYAMAT KE ,KISMAT(1968) ,MAHENDRA KAPOOR 
20058,AANKI CHALI BANKI CHALI ,NAMKEEN ,ASHA BHOSLE 
20059,AAO BACHCHON TUMHEN DIKHAYEN ,JAGRITI ,PRADEEP 
20060,AAO TUMHE CHAAND PE ,ZAKHMEE ,LATA,SUSHMA SHRESTHA 
20061,AAP AAYE BAHAR AAYI ,AAP AAYE BAHAAR AAYI ,MOHD. RAFI 
20062,AAP KA AANA ,KURUKSHETRA ,ALKA, KUMAR SANU 
20063,AAP KI AANKHON MEIN KUCH ,GHAR ,LATA, KISHORE KUMAR 
20064,AAP KI INAAYATEN ,VANDANA ,LATA MANGESHKAR 
20065,AAP KI NAZARON NE SAMJHA ,ANPADH ,LATA MANGESHKAR 
20066,AAP MUJHE ACHHE ,JEENE KI RAAH ,LATA MANGESHKAR 
20067,AAP YAHAN AAYE KIS LIYE ,KAL AAJ AUR KAL ,KISHORE, ASHA 
20068,AAP YUN HI IAGAR ,EK MUSAFIR EK HASEENA ,ASHA BHOSLE, MOHD. RAFI 
20069,AAPKE HASEEN RUKH PE ,BAHAAREN FIR BHI AAYENGI ,MOHD. RAFI 
20070,AAPKE PEHLOON MEIN AAKAR RO DIYE ,MERA SAAYA ,MOHD. RAFI 
20071,AAPNE YAAD DILAAYA TO ,AARTI ,MOHD. RAFI,LATA MANGESHKAR 
20072,AAPSE PYAAR HUA ,AABROO ,ASHA BHOSLE 
20073,AASHAON KE SAAWAN MEIN ,AASHA ,MOHD. RAFI, LATA 
20074,AASHIQIE MEIN HAD SE ,THE GENTLEMAN ,VINOD RATHOD.SADHANA 
20075,AASMAAN SE AAYA FARISHTA ,AN EVENING IN PARIS ,MOHD. RAFI 
20076,AASMAN KE NEECHE ,JEWEL THIEF ,KISHORE, LATA 
20077,AATE JAATE HASTE GAATE ,MAINE PYAAR KIYA ,LATA MANGESHKAR & S.P.B. 
20078,AATE JAATE KHOOBSURAT AAWARA SADKON PE ,ANURODH ,KISHORE KUMAR 
20079,AAWAAZ DE KAHAAN HAI ,ANMOL GHADI ,NOOR JAHAAN & SURENDRA 
20080,AAWARAPAN BANJARAPAN ,JISM ,K.K. 
20081,AAYA SAAWAN JHOOM KE ,AAYA SAAWAN JHOOM KE ,MOHD. RAFI, LATA 
20082,AAYA SANAM AAYA DEEWANA ,BADE DILWALA ,KISHORE KUMAR 
20083,AAYE TUM YAAD MUJHE ,MILI ,KISHORE KUMAR 
20084,AAYEGA AAYEGA AANEWALA ,MEHAL ,LATA MANGESHKAR 
20085,AAYEGI AAYEGI AAYEGI ,JAANEMAN ,LATA MANGESHKAR 
20086,AAYI AAYI MAIN TO AAYI ,JAANI DOST ,KISHORE KUMAR,ASHA 
20087,AAYINA HAI MERA CHEHRA ,AAYINA ,ASHA BHOSLE, SURESH WADKAR 
20088,AAYIYE MEHERBAAN ,HOWRAH BRIDGE ,ASHA BHOSLE 
20089,AAZMAALE AAZMAALE ,TAXI NO. 9211 ,SHEKHAR RAVJIANI 
20090,AB CHAAHE MAA RUTHE ,DAAG(1973) ,LATA,KISHORE KUMAR 
20091,AB KE BARAS TUJHE ,KRANTI ,MAHENDRA KAPOOF 
20092,AB KE SAAWAN MEIN ,DIL\ L PYAAR VYAAR ,SADHNA SARGAM, BAABULS 
20093,AB KE SAJAN SAAVAN MEIN ,CHUPKE CHUPKE ,LATA MANGESHKAR 
20094,AB KYA MISAAL DUN ,AARTI ,MOHD. RAFI 
20095,AB TAK HAI PURI AZADI ,KUDRAT(1998) ,ABHIJEET.POORNIMA 
20096,AB TERE DIL MEIN HUM ,AARZ00(1999) ,KUMAR SANU,ALKA 
20097,AB TO HAIN TUM SE ,ABHIMAAN ,LATA MANGESHKAR 
20098,AB TO MUSKURAIYE ,RANU MUKHERJEE ,DO DOONI CHAR 
20099,ABHI NA JAO CHHOD KAR ,HUM DONO ,ASHA BHOSLE & MOHD.I RAFI 
20100,ABHI TO HUM HUE ,BULUNDI ,KISHORE KUMAR 
20101,ACHCHI LAGTI HO ,KUCHH NA KAHO ,UDIT NARAYAN, KAVITA K. 
20102,ACHHA JEE MAIN HAARI ,KALA PAANI ,MOHD.RAFI, ASHA 
20103,ACHHA TO HUM CHALTE HAIN ,AAN MILO SAJANA ,LATA, KISHORE KUMAR 
20104,AE CHAAND ZARA CHHUPJAA ,LAAT SAHEB ,ASHA,MOHD. RAFI 
20105,AE DIL MUJHE BATA DE ,BHAI BHAI ,GEETA DUTT 
20106,AE KAASH KISI DEEWANE KO ,AAYE DIN BAHAAR KE ,ASHA, LATA 
20107,AE KHUDA SHUKRA TERA ,RAZIA SULTAN ,MAHENDRA KAPOOR BHUPINDER 
20108,AE MALIK TERE ,DO AANKHEN BARAH HAATH ,LATA MANGESHKAR 
20109,AE MERE DIL KAHIN. AUR CHAL ,DAAG(1952) ,TALAT MEHMOOD 
20110,AE MERI JOHRAJABI ,WAQT(1965) ,MANNA DEY 
20111,AE MOHABBAT TERI DASTAN ,KARMA ,ANURADHA PAUDWAL 
20112,AE MOHABBAT ZINDABAD ,MUGHAL E AAZAM ,MOHD. RAFI 
20113,AE OH AA ZARA MUDKE ,DISCO DANCER ,KISHORE KUMAR 
20114,AE PHOOLON KI RAANI ,AARZ00 ,MOHD. RAFI 
20115,AE YAAR SUN YAARI TERI ,SUHAAG ,ASHA,RAFI,SHAILENDRA 
20116,AEY BHAAI ZARA ,MERA NAAM JOKER ,MANNA DEY 
20117,AEY NARGISE MASTANA ,AARZ00 ,MOHD. RAFI 
20118,AFSANA LIKH RAHI HOON ,DARD(1947) ,UMA DEVI 
20119,AGAR MUJHSE MOHABBAT ,AAP KI PARCHHAIYAAN ,LATA MANGESHKAR 
20120,AGAR TUM MIL JAO ,ZEHER ,SHREYA GHOSHAL 
20121,AISA LAGTA HAI ,REFUGEE ,ALKA,SONU NIGAM 
20122,AISI HASEEN CHAANDNI ,DARD(1981) ,KISHORE KUMAR 
20123,AISI RANG DE PIYA ,BABU ,LATA, KISHORE KUMAR 
20124,AJA PIYA TOHE PYAR DUN ,BAHARON KE SAPNE ,LATA MANGESHKAR 
20125,AJEEB DAASTAN HAI YEH ,DIL APNA AUR PREET PARAI ,LATA MANGESHKAR 
20126,AJI ROOTH KAR AB ,AARZ00 ,LATA MANGESHKAR 
20127,AKELA CHAL CHALA CHAL ,FAKIRA ,HEMLATA 
20128,AKELE AKELE KAHAAN JAA RAHE HO ,AN EVENING IN PARIS ,MOHD. RAFI 
20129,AKELE HAIN ,RAAZ ,LATA MANGESHKAR 
20130,AKELE HI AKELE ,GOPI ,LATA MANGESHKAR 
20131,AKHIYAN BHOOL GAYI HAI SONA ,GUNJ UTHI SHEHNAAY| ,GEETA ROY, LATA 
20132,ALLAH TERO NAAM ,HUM DONO ,LATA MANGESHKAR 
20133,AMIRON KI SHAAM ,NAAM ,MOHD. AZIZ 
20134,AN EVENING IN PARIS ,AN EVENING IN PARIS ,MOHD. RAFI 
20135,ANG SE ANG LAGANA ,DARR ,ALKA,SUDESH,VINOD 
20136,ANGREZI MEIN KEHTE HAI ,KHUDDAR ,LATA, KISHORE KUMAR 
20137,ANHKON MEIN TUM ,HALF TICKET ,GEETA DUTT, KISHORE KUMAR 
20138,ANKHIYAN MILA KE ,RATTAN ,ZOHRABAI LAMBALAWALI 
20139,ANKHIYON KE JHAROKON SE ,ANKHIYON KE JHAROKON SE ,HEMLATA 
20140,ANKHIYON KO RAHNE DE ,BOBBY ,LATA MANGESHKAR 
20141,ANKHON HI ANKHON MEIN ,C.I.D. ,GEETA DUTT, MOHD. RAFI 
20142,APKE ANURODH PE ,ANURODH ,KISHORE KUMAR 
20143,APLAM CHAPLAM CHAPALAA RE ,AAZAD ,USHA MANGESHKAR 
20144,APNA JEEVAN RAIL KI ,LOVE MARRIAGE(1984) ,SHABBIR,ANURADHA 
20145,APNI AANKHON KE ,POLICE AUR MUJRIM ,MOHD. AZIZ,SADHANA 
20146,APNIAAZADI KO HUM ,JAAGRUTI ,MOHD. RAFI 
20147,APNIAPNI BIWI PE ,DO RAASTE ,LATA MANGESHKAR 
20148,APNI SANTOSHI MAA ,JAI SANTOSHI MAA ,MAHENDRA KAPOOR 
20149,APRIL FOOL BANAYA ,APRIL FOOL ,MOHD. RAFI 
20150,ARE HAAY HAAY YEH MAZBOORI ,ROTI KAPDA AUR MAKAAN ,LATA MANGESHKAR 
20151,ARE JAANE KAISE KAB ,SHAKTI ,LATA,KISHORE KUMAR 
20152,ARE KAR LE JO BHI ,DHOOL KA PHOOL ,MAHENDRA KAPOOR 
20153,ARE NANANANA ,AAR PAAR ,GEETA DUTT, MOHD. RAFI 
20154,ARE SASU TEERATH ,SAUTAN ,KISHORE KUMAR 
20155,ARE SUN BHAI SAADHO ,JAANI DUSHMAN ,ASHA,MAHENDRA,KISHOR 
20156,ASSA HUN TUR JANAYE ,ARPAN ,LATA JI SURESH WADKAR 
20157,AUR IS DIL MEIN ,IMAANDAR ,SURESH WADEKAR,ASHA BHOSLE 
20158,AUR NAHEE BAS AUR NAHI ,ROTI KAPDA AUR MAKAAN ,MAHENDRA KAPOOR 
20159,AWAARA BHANWRE ,SAPNAY ,HEMA,MALAYSIA 
20160,AWAARA HOON ,AAWAARA ,MUKESH 
20161,AWAARA PAGAL DEEWANA ,AWAARA PAGAL DEEWANA ,SUNIDHI,SHAAN 
20162,AWAZ DO HUMKO ,DUSHMAN ,LATA, UDIT NARAYAN 
20163,AYE BEKHABAR ,ZEHER ,K.K,SHREYA,ATIF,UDIT 
20164,AYE DIL E NADAN ,RAZIA SULTAN ,LATA MANGESHKAR 
20165,AYE DIL MUJHE AISI ,AARZ00 (OLD) ,TALAT MEHMOOD 
20166,AYE GULBADAN AYE GULBADAN ,PROFESSOR ,MOHD. RAFI 
20167,AYE MERE PYAARE VATAN ,KAABULI WALA ,MANNA DEY 
20168,AYHELE DIL YUN BHI ,DARD ,LATA MANGEHSKAR 
20169,BAABU SAMJHO ISHAARE ,CHALTI KA NAAM GAADI ,KISHORE KUMAR, MANNA DEY 
20170,BAABUL JO TUMNE SIKHAAYA ,HUM AAPKE HAIN KAUN ,SHARDA SINHA 
20171,BAABUL KI DUAAYEN LETI JA ,NEEL KAMAL ,MOHD. RAFI 
20172,BAADAL YUN GARJTA HAI ,BETAAB ,LATA, SHABBIR KUMAR 
20173,BAAGON KI TU RAANI ,JAANI DOST ,KISHORE KUMAR,ASHA 
20174,BAAGON MEIN KAISE ,CHUPKE CHUPKE ,LATA,MUKESH 
20175,BAAHON MEIN CHALE AAO ,ANAMIKA ,LATA MANGESHKAR 
20176,BAAHON MEIN TERI MASTI ,KAALA PATTHAR ,MOHD. RAFI,LATA 
20177,BAAP KI JAGAH MAA LE SAKTI HAI ,DARD KA RISHTA ,KISHORE KUMAR 
20178,BAAR BAAR DEKHO HAZAAR BAAR DEKHO ,CHINA TOWN ,MOHD. RAFI 
20179,BAAR BAAR DIN YE AAYE ,FARZ ,MOHD. RAFI 
20180,BABALU BABALU BA BA ,JHUMROO ,KISHORE KUMAR,ASHA 
20181,BABUJI DHEERE CHALNA ,AAR PAAR ,GEETA DUTT 
20182,BACHCHE MANN KE SACHCHE ,DO KALIYAN ,LATA MANGESHKAR 
20183,BADA NATKHAT HAI RE ,AMAR PREM ,LATA MANGESHKAR 
20184,BADA SHAITAN HAI DIL ,IMAANDAAR ,KISHORE KUMAR 
20185,BADAN PE SITAARE ,PRINCE ,MOHD. RAFI 
20186,BADE ARMAANON SE ,MALHAR ,LATA,MUKESH 
20187,BADI SUNI SUNI HAI ,MILI ,KISHORE KUMAR 
20188,BAGHON MEIN BAHAAR HAI ,ARADHANA ,LATA MANGESHKAR,MOHD.RAF 
20189,BAHUT DER KAR DI ,TAWAIF ,ASHA BHOSLE 
20190,BAHUT KAT CHUKA HAI ,MOHABBAT KE DUSHMAN ,ASHA BHOSLE 
20191,BAHUT SHUKRIYA BADI MEHARBAANI ,EK MUSAFIR EK HASINA ,MOHD.RAFI,ASHA 
20192,BAIYAN NA DHARO ,DASTAK(1970) ,LATA MANGESHKAR 
20193,BALMA BADA NADAAN RE ,ALBELA ,LATA MANGESHKAR 
20194,BAMBAI NAGARIYA ,TAXI NO. 9211 ,BAPPI LAHARI 
20195,BAMBAI SE AAYA MERA DOST ,AAP KI KHATIR ,BAPPI LAHIRI 
20196,BAN THAN ,KURUKSHETRA ,SUKHWINDER,SUNIDH 
20197,BANAKE KYUN BIGAADA RE ,ZANJEER ,LATA MANGESHKAR 
20198,BANDA PARWAR ,PHIR WAHI DIL LAAYA HOON ,MOHD. RAFI 
20199,BANDA YEH BINDAS HAI ,AKS ,K.K, KUNAL 
20200,BANGLA GAADI JHUMKE ,CHHUPA RUSTAM(2000) ,ALKA YAGNIK 
20201,BANNO KI LAAYEGI ,AAINA ,PAMELA CHOPRA 
20202,BANNO TERI ANKHIYA SURMEDANI ,DUSHMANI ,SAPNA AVASTI 
20203,BARSAAT MEIN HUMSE MILE ,BARSAAT ,LATA MANGESHKAR 
20204,BECHAIN MERA YE DIL HAI ,YEH MOHABBAT HAI ,UDIT NARAYAN,ALKA 
20205,BECHARA DIL KYA KARE ,KHUSHBOO ,ASHA BHOSLE 
20206,BEDARDI BAALAMA TUJHKO ,ARZ00(1965) ,LATA MANGESHKAR 
20207,BEDARDI TERE PYAR NE ,HEENA ,LATA MANGESHKAR 
20208,BEETE HUE LAMHO KI ,NIKAAH ,MAHENDRA KAPOOR 
20209,BEETI NA BITAAYI RAINA ,PARICHAY ,LATA MANGESHKAR. BHUPINDER 
20210,BEKHUDI ,TAXI NO. 9 2 11 ,SHAAN 
20211,BEKHUDI MEIN SANAM ,HASEENA MAAN JAAYEGI ,LATA JI, MOHD. RAFI 
20212,BEQARAAR KARKE HUMEN ,BEES SAAL BAAD(1961) ,HEMANT KUMAR 
20213,BETAAB DIL KI TAMANNA ,HANSTE ZAKHM ,LATA MANGESHKAR 
20214,BHAGI RE BHAGI ,RAJPUT ,MAHENDRA.MANHAR,ASHA 
20215,BHAI BATTOOR ,PADOSAN ,LATA MANGESHKAR 
20216,BHAIYA MERE ,CHHOTI BAHEN ,LATA MANGESHKAR 
20217,BHALI BHALI SI ,BUDDHA MIL GAYA ,ASHA BHOSLE, KISHORE KUMAR 
20218,BHANVARE NE KHILAYA PHOOL ,PREMROG ,LATA, SURESH WADKAR 
20219,BHANWARA BADA NAADAN ,SAHIB BIBI AUR GHULAM ,ASHA BHOSLE 
20220,BHANWARE KI GUNJAN ,KAL AAJ AUR KAL ,KISHORE KUMAR 
20221,BHARAT KA REHNA WALA HOOI ,PURAB AUR PACHHIM ,MAHENDRA KAPOOR 
20222,BHEED MEIN TANHAAI MEIN ,TUMSA NAHIN DEKHA ,UDIT, SHREYA GHOSHAL 
20223,BHEEGE HONTH TERE ,MURDER ,KUNAL GANJAWALA 
20224,BHEEGI BHEEGI RAATON MEIN ,AJNABI ,LATA, KISHORE KUMAR 
20225,BHEEGI BHEEGI SI HAI ,GANGSTER ,JAMES 
20226,BHOLE RE SAJAN ,BADHTI KA NAAM DAADHI ,KISHORE KUMAR 
20227,BHOLI SURAT DIL KE KHOTE ,ALBELA ,LATA.CHITALKAR 
20228,BHOR BHAYE PANGHAT PE ,SATYAM SHIVAM SUNDARAM ,LATA MANGESHKAR 
20229,BIN SAAJAN JHOOLA JHOOLUN ,DAMINI ,SANU,SADHANA SARGAM 
20230,BOL BABY BOL ,MERI JUNG ,KISHORE,S.JANAKI 
20231,BOL MERI TAQDEER ,HARIYALI AUR RAASTA ,LATA. JI, MOHD. RAFI 
20232,BOL RADHA BOL SANGAM ,SANGAM ,MUKESH 
20233,BOL RI KATHAPUTLI ,KATHPUTLI ,LATA MANGESHKAR 
20234,BOLO BOLO ,REHNA HAI TERE DIL MEIN ,SHAAN 
20235,BOOJH MERA KYA NAAM RE ,C.I.D. ,SHAMSHAD BEGUM 
20236,BOONDON SE BAATEN ,TAQSHAK ,SUJATA TRIVEDI 
20237,BORO BORO BURE BURE ,BLUFF MASTER ,ARASH 
20238,BUJHA DO DEEPAK ,DARPAN ,KISHORE KUMAR 
20239,BURA MAT SUNO ,AAYA SAAWAN JHOOM KE ,MOHD. RAFI 
20240,BURA NA MANO ,AADMI SADAK KA ,MOHD. RAFI,ANURADHA 
20241,BUS MERI JAAN BUS ,AANCHAL ,LATA, KISHORE KUMAR 
20242,BUS YEHI APRAADH MAIN HAR BAAR ,PEHCHAN ,MUKESH 
20243,CAT CAT ,DILLI KA DHAG ,ASHA BHOSLE, KISHORE KUMAR 
20244,CHAAND JAISE MUKHDE PE ,SAAWAN KO AANE DO ,K. YESUDAS 
20245,CHAAND MERA DIL ,HUM KISISE KAM NAHI ,MOHD. RAFI 
20246,CHAAND SI MEHB00BA ,HIMAALAY KI GOD MEIN ,MUKESH 
20247,CHAAND SITARE PHOOL ,KAHO NA PYAAR HAI ,KUMAR SANU 
20248,CHAANDANI 0 MERI CHAANDANI ,CHHANDANI ,JOLLY MUKHARJEE, SRIDEVI 
20249,CHADHTI JAWAANI MERI ,CARAVAN ,LATA, MOHD. RAFI 
20250,CHAHE RAHO DOOR ,DO CHOR ,LATA, KISHORE KUMAR 
20251,CHAHIYE THODA PYAAR ,LAHOO KE DO RANG ,KISHORE KUMAR 
20252,CHAHUNGA MAIN TUJHE ,DOSTI ,MOHD. RAFI 
20253,CHAKKE MEIN CHAKKA ,BRAHMACHARI ,MOHD. RAFI 
20254,CHAL AKELA CHAL AKELA ,SAMBANDH ,MUKESH 
20255,CHAL CHAL MERE SAATHI ,HAATHI MERE SAATHI ,KISHORE KUMAR 
20256,CHAL CHALEN AE DIL ,JHEEL KE US PAAR ,LATA MANGESHKAR 
20257,CHAL CHAMELI BAAG MEIN ,KRODHI ,LATA,SURESH WADKAR 
20258,CHAL DARIYA MEIN ,PREM KAHANI ,LATA,KISHORE KUMAR 
20259,CHALAT MUSAFIR ,TEESRI KASAM ,MANNA DEY 
20260,CHALE JAANA NAHI ,BADI BAHEN ,LATA MANGESHKAR 
20261,CHALE JANA ZARA TEHRO ,AROUND THE WORLD ,MUKESH, SHARDA 
20262,CHALE THE SAATH MILKAR ,HASINA MAAN JAYEGI ,MOHD. RAFI 
20263,CHALI CHALI RE PATANG ,BHABHI ,LATA, MOHD. RAFI 
20264,CHALI MERI DULHAN KI DOLI ,DARPAN ,MOHD. RAFI 
20265,CHALO DILDAR CHALO ,PAKEEZHA ,LATA, MOHD. RAFI 
20266,CHALO EK BAAR PHIR SE ,GUMRAAH ,MAHENDRA KAPOOR 
20267,CHALO RE DOLI UTHAAO ,JAANI DUSHMAN ,MOHD. RAFI 
20268,CHALO TUMKO LEKAR CHALE ,JISM ,SHREYA GHOSHAL 
20269,CHALTE CHALTE YUN HI KOI ,PAKEEZHA ,LATA MANGESHKAR 
20270,CHALTI KA NAAM ZINDAGI ,CHALTI KA NAAM ZINDAGI ,KISHORE,MAHENDRA 
20271,CHANA ZOR GARAM ,KRANTI ,LATA,KISHORE,RAFI 
20272,CHAND AAHEN BHAREGA ,PHOOL BANE ANGAARE ,MUKESH 
20273,CHANDA HAI TU ,ARADHANA ,LATA MANGESHKAR 
20274,CHANDA KO DHUNDNE ,JEENE KI RAAH ,ASHA,USHA,HEMLATA 
20275,CHANDA 0 CHANDA ,LAAKHON MEIN EK ,LATA MANGESHKAR 
20276,CHANDA RE CHANDA RE ,SAPNEY ,HARIHARAN, SADHANA 
20277,CHANDAN SA BADAN ,SARASWATI CHANDRA ,MUKESH 
20278,CHANDI KI DEEWAR NA TODI ,VISHWAAS ,MUKESH 
20279,CHANDNI RAAT MEIN ,DIL-E-NADAAN ,LATA,KISHORE KUMAR 
20280,CHANDRALEKHA ,CHOR CHOR ,ANUPAMA, A.R. REHMAN 
20281,CHAUDAHVEEN KA CHAAND ,CHAUDHAVEEN KA CHAAND ,MOHD. RAFI 
20282,CHEHRE PE GIRE ZULFEN ,SURAJ ,MOHD. RAFI 
20283,CHHALIYA MERA NAAM ,CHHALIA (1960) ,MUKESH 
20284,CHHALKE TERI AANKHON SE ,ARZ00(1965) ,MOHD. RAFI 
20285,CHHOD DE SARI DUNIYA ,SARASWATI CHANDRA ,LATA MANGESHKAR 
20286,CHHODO KAL KI BAATEIN ,HUM HINDUSTANI ,MUKESH 
20287,CHHODO SANAM KAAHE KA GAM ,KUDRAT ,KISHORE, ANETTE 
20288,CHHOO LENE DO ,KAAJAL ,MOHD. RAFI 
20289,CHHOTI SI KAHANI SE ,IJAAZAT ,ASHA BHOSLE 
20290,CHHOTI SI IYEH ZINDAGANI ,AAH ,MUKESH 
20291,CHHUP GAYE SARE NAZARE ,DO RAASTEN ,LATA, MOHD. RAFI 
20292,CHHUPA LO YUN DIL ,MAMTA ,HEMANT KUMAR, LATA 
20293,CHIDIYA CHIDIYA ,DUSHMAN(1998) ,CHORUS 
20294,CHIL CHIL CHILLA KE ,HALF TICKET ,KISHORE KUMAR 
20295,CHINGARI KOI BHADKE ,AMARPREM ,KISHORE KUMAR 
20296,CHIRAG DIL KA JALAAO ,CHIRAG ,MOHD. RAFI 
20297,CHITTHI NA KOI SANDES ,DUSHMAN ,JAGJIT SINGH 
20298,CHOCLATE LIME JUICE ,HUM AAPKE HAIN KAUN ,LATA MANGESHKAR 
20299,CHORI CHORI ,OM JAI JAGDISH ,SONU NIGAM, ALKA YAGNIK 
20300,CHORI CHORI KOI AAYE ,NOORIE ,LATA MANGESHKAR 
20301,CHOTI SI UMAR MEIN ,BAIRAAG ,LATA MANGESHKAR 
20302,CHUN CHUN GHUNGARU BOLE ,FAAGUN ,ASHA BHOSLE 
20303,CHUN CHUN KARTI AAYI ,AB DILLI DOOR NAHIN ,MOHD. RAFI 
20304,CHUP CHUP KHADE HO ,BADI BAHEN ,LATA,PREMLATA 
20305,CHUPKE CHUPKE RAAT DIN ,NIKAAH ,GHULAM ALI 
20306,CHURA LIYA HAI TUMNE JO DIL KO ,YAADON KI BARAAT ,ASHA BHOSLE, MOHD. RAFI 
20307,CHURAAYA CHURAAYA ,REHNA HAI TERE DIL MEIN ,PREETI, PINKY 
20308,CRY CRY ,JHOOTA HI SAHI ,SHREYA, RASHID ALI 
20309,DAFLI WALE DAFLI BAJA ,SARGAM ,LATA, MOHD.RAFI 
20310,DAGA DAGA VAI VAI VAI ,KALITOPILAL RUMAL ,LATA MANGESHKAR 
20311,DAM BHAR J UDHAR MUH ,AAWARA ,LATA,MUKESH 
20312,DARDE DIL DARDE JIGAR ,KARZ ,MOHD. RAFI 
20313,DARIYA KINARE EK ,SABSE BADA RUPAIYA ,LATA,KISHORE KUMAR 
20314,DARWAZA BAND KAR LO ,DARR ,LATA,ABHIJEET 
20315,DE DAARU ,KARMA ,KISHORE,MANHAR 
20316,DE DE PYAAR DE ,SHARAABI ,KISHORE KUMAR 
20317,DEEWANA HUA BAADAL ,KASHMIR KI KALI ,MOHD.RAFI.ASHA BHOSLE 
20318,DEEWANA MUJH SA NAHIN ,TEESARI MANZIL ,MOHD. RAFI 
20319,DEEWANE KA NAAM TO PUCHHO ,AN EVENING IN PARIS ,MOHD. RAFI 
20320,DEEWANON SE YEH MAT PUCHHO ,UPKAAR ,MUKESH 
20321,DEKH CHAAND KI AUR ,AAG ,S. BEGUM,SHAILESH 
20322,DEKH KE YE ROOMAL ,BEKHUDI ,ASHA BHOSLE 
20323,DEKH TERE SANSAR Kl HAALAT ,NASTIK ,PRADIP 
20324,DEKHA EK KHWAB TO YE ,SILSILA ,LATA, KISHORE KUMAR 
20325,DEKHA NA HAYE RE ,BOMBAY TO GOA ,KISHORE KUMAR 
20326,DEKHO MAINE DEKHA ,LOVE STORY ,LATA, AMIT KUMAR 
20327,DEKHO ROOTHA NA KARO ,TERE GHAR KE SAMNE ,LATA,MOHD. RAFI 
20328,DENEWALA ,HERA PHERA ,ABHIJEET,VINOD 
20329,DHAL GAYA I DIN ,HUMJOLI ,ASHA, MOHD. RAFI 
20330,DHANYA BHAAG SEVA KA ,SUR SANGAM ,RAJAN,SAJAN,KAVITAK 
20331,DHEERE DHEERE ,KALYUG ,ALISHA CHINOY 
20332,DHEERE DHEERE BOL ,GORA AUR KAALA ,LATA MANGESHKAR 
20333,DHEERE DHEERE CHAL ,LOVE MARRIAGE(1959) ,LATA MANGESHKAR, MOHD.RAFI 
20334,DHEERE DHEERE MACHAL ,ANUPAMA ,LATA MANGESHKAR 
20335,DHEERE DHEERE ZARA ,AGAR TUM NA HOTE ,ASHA BHOSALE 
20336,DHEERE SE AAJA RI ,ALBELA ,LATA MANGESHKAR 
20337,DHEERE SE JAANA KHATIYAN MEIN ,CHHUPA RUSTAM ,KISHORE KUMAR 
20338,DHOKA ,DHOKA ,RAFAQAT ALI KHAN 
20339,DHOL BAJNE LAGA ,VIRAASAT ,KAVITA K., UDIT NARAYAN 
20340,DHOOM MACHE DHOOM ,KAALA PATTHAR ,LATA,RAFI,MAHENDRA 
20341,DHUNDHE TUJHKO NAIN ,JAB YAAD KISI KI AATI HAI ,LATA,MAHENDRA 
20342,DIDI TERA DEVAR DEEWANA ,HUM AAPKE HAI KAUN ,LATA, S.P.BALA'UM 
20343,DIKHAI DIYE YUN ,BAAZAR ,LATA MANGESHKAR 
20344,DIL AASHNA HAI ,DIL AASHNA HAI ,SURESH WADKAR,SADHNA 
20345,DIL AISA KISI NE MERA ,AMANUSH ,KISHORE KUMAR 
20346,DIL APNA AUR PREET PARAYEE ,DIL APNA AUR PREET PARAI ,LATA MANGESHKAR 
20347,DIL DEEWANA BIN SAJANA KE ,MAINE PYAAR KIYA ,LATA MANGESHKAR 
20348,DIL DEKE DEKHO ,DIL DEKE DEKHO ,MOHD. RAFI 
20349,DIL DENE KI RUT AAYI ,PREM GRANTH ,ALKA YAGNIK,VINOD 
20350,DIL DHADKE ,DARD ,SURAIYYA 
20351,DIL DHADKE NAZAR SHARMAAYE ,ALBELA ,LATA MANGESHKAR 
20352,DIL DHOONDTA HAI ,MAASOOM ,BHUPINDER 
20353,DIL DIYA HAI JAAN BHI DENGE ,KARMA ,MOHD. AZIZ, KAVITA K. 
20354,DIL EK MANDIR HAI ,DIL EK MANDIR ,MOHD. RAFI,SUMAN 
20355,DIL GHABARATA HAI ,POLICE AUR MUJRIM ,AMIT KUMAR 
20356,DIL HAAYE MERA DIL ,PARAYA DHAN ,KISHORE KUMAR 
20357,DIL HAI KI DHADAKTA ,JAHAN PYAR MILE ,MOHD. RAFI 
20358,DIL JALON KA ,ZANJEER ,ASHA BHOSLE 
20359,DIL KA BHANWAR KARE ,TERE GHAR KE SAMNE ,MOHD. RAFI 
20360,DIL KA HAAL SUNE ,SHREE 420 ,MANNA DEY 
20361,DIL KAHE RUK JAA RE ,MANN KIAANKHEN ,MOHD. RAFI 
20362,DIL KE ARMAAN ,NIKAAH ,SALMA AAGAH 
20363,DIL KE JHAROKE MAIN ,BRAHMACHAARI ,MOHD. RAFI 
20364,DIL KI AAWAAZ BHI SUN ,HUM SAAYA ,MOHD. RAFI 
20365,DIL KI GIRAH ,RAAT AUR DIN ,LATA MANGESHKAR, MANNA DEY 
20366,DIL KI NAZAR SE ,ANARI(1959) ,LATA MANGESHKAR.MUKESH 
20367,DIL KI LYE AARZU ,NIKAAH ,SALMA AAGAH, MAHENDRA K 
20368,DIL KO HAZAAR BAAR ,MURDER ,ALISHA CHINOY 
20369,DIL KO TUMSE PYAAR HUA ,REHNA HAI TERE DIL MEIN ,ROOP KUMAR RATHODE 
20370,DIL LE GAYI TERI BINDIYA ,VISHWATMA ,AMIT,MO.AZIZ,SAPNA 
20371,DIL LEKE ,NA TUM JAANO NA HUM ,PAMELA JAIN, UDIT NARAYAN 
20372,DIL MEIN KYA HAI ,JIGRI DOST ,LATA,MOHD. RAFI 
20373,DIL NE DIL SE KYA KAHA ,AAINA ,LATA, NITIN MUKESH 
20374,DIL NE PHIR YAAD KIYA ,DIL NE PHIR YAAD KIYA ,MOHD.RAFI MUKESH, SUMAN K 
20375,DIL PUKAARE AA RE AA RE ,JEWEL THIEF ,MOHD. RAFI, LATA 
20376,DIL TADAP TADAP KE ,MADHUMATI ,LATA MANGEHSKAR, MUKESH 
20377,DIL TO DIL HAI ,ZINDAGI EK JUA ,ASHA BHOSLE 
20378,DIL TO HAI DIL ,MUQADDAR KA SIKANDAR ,LATA MANGESHKAR 
20379,DIL TODANE WALE ,RAAGINI ,ASHA BHOSLE 
20380,DIL TOOT GAYA ,AAG ,SHAMSHAD BEGAM 
20381,DIL USE DO JO JAAN DE DE ,ANDAAZ ,ASHA BHOSLE, MOHD. RAFI 
20382,DILBAR DIL SE PYARE ,CARAVAN ,LATA MANGESHKAR 
20383,DILLI DILLI ,NO ONE KILLED JESSICA ,ADITI,TOCHI,SHRIRAM 
20384,DIN DHAL JAAYE ,GUIDE ,MOHD. RAFI 
20385,DIN HAI BAHAAR KE ,WAQT ,ASHA,MAHENDRA KAPOOR 
20386,DIN MAHEENE SAAL ,AVTAAR ,LATA, KISHORE KUMAR 
20387,DING DONG ,HERO ,ANURADHA.MANHAR 
20388,DISCO 82 ,KHUDDAAR ,LATA,KISHORE KUMAR 
20389,DIWAANE HAI DIWAANO KO NA ,ZANZEER ,LATA, MOHD. RAFI 
20390,DIYE JALAAYE PYAR KE ,DHARTI KAHE PUKAR KE ,LATA MANGESHKAR 
20391,DIYE JALTE HAI ,NAMAK HARAAM ,KISHORE KUMAR 
20392,DO ANJAANE AJNABI ,VIVAH ,UDIT NARAYAN, SHREYA 
20393,DO BAATEN PYAAR BHARI ,AANKHON AANKHON MEIN ,KISHORE KUMAR, ASHA 
20394,DO GHOOT MUJHE BHI ,JHEEL KE US PAAR ,LATA MANGESHKAR 
20395,DO HANSO KA JODA ,GANGA JAMUNA ,LATA MANGESHKAR 
20396,DO LAFZON KI IHA ,THE GREAT GAMBLER ,ASHA BHOSLE 
20397,DO NAINA AUR EK KAHANI ,MASOOM ,AARTI MUKHARJEE 
20398,DO NISHAANIYAN ,JHOOTA HI SAHI ,SONU NIGAM 
20399,DOLI MEIN BITHHAL KE KAHAAR ,AMAR PREM ,D.BURMAN 
20400,DONON NE KIYA THA ,MAHUA ,MOHD. RAFI 
20401,DOOR REH KAR ,AMAANAT ,MOHD. RAFI 
20402,DOORI NA RAHE KOI ,KARTAVYA ,LATA MANGESHKAR 
20403,DOST DOST NA RAHA ,SANGAM ,MUKESH 
20404,DOSTI KARTE NAHIN ,AARZ00 ,KUMAR SANU,ALKA,UDIT 
20405,DOSTON MEIN KOI BAAT ,PREM KAHANI ,MOHD. RAFI 
20406,DUKH SUKH KI ,KUDRAT(1980) ,CHANDRASEKHAR GADGIL 
20407,DUKHI MANN MERE ,FUNTOOSH ,KISHORE KUMAR 
20408,DULHAN CHALI ,PURAB AUR PASCHHIM ,MAHENDRA KAPOOR 
20409,DULHAN SE TUMHARA ,ANOKHI RAAT ,MUKESH 
20410,DUM DUM DIGA DIGA ,CHHALIYA (1960) ,MUKESH 
20411,DUM MAARO DAM ,HARE KRISHNA HARE RAM ,ASHA BHOSLE 
20412,DUNIYA BANAANE WALE ,TEESRI KASAM ,MUKESH 
20413,DUNIYA KARE SAWAAL ,BAHU BEGAM ,LATA MANGESHKAR 
20414,DUNIYA MEIN KITNA GAM ,AMRIT ,ANURADHA,MOHD.AZIZ 
20415,DUNIYA MEIN LOGON KO ,APNA DESH ,ASHA BHOSLE, R.D. BURMAN 
20416,DUNIYA MEIN REHNA HAI TO KAAM KAR PYARE ,HAATHI MERE SAATHI ,KISHORE KUMAR 
20417,DUNIYA MUJHKO PAAGAL ,24 GHANTE ,MUKESH 
20418,DUNIYA SE JAANE WALE ,PUSHPANJALI ,MUKESH 
20419,DUNIYAN KI SAIR KAR LO ,AROUND THE WORLD ,MUKESH, SHARDA 
20420,DUNIYAN MEIN KITNA GUM HAI ,AMRIT ,ANURADHA PAUDWAL 
20421,DUPATTA MERA MALMAL KA ,ADALAT ,ASHA,GEETA DUTT 
20422,EENA MEENA DIKA ,AASHA ,KISHORE KUMAR 
20423,EHSAAN TERA HOGA MUJH PAR ,JUNGLEE ,MOHD. RAFI 
20424,EK ADHURI SI MULAQAT ,DAHLEEZ ,MAHENDRA,BHUPINDER 
20425,EK AJNABI HASEENA SE ,AJNABI ,KISHORE KUMAR 
20426,EK AKELAIS SHEHER MEIN ,GHARONDA ,BHUPINDER SINGH 
20427,EK BAAR SIRF EK BAAR ,AADHA DIN AADHI RAAT ,ASHA BHOSLE 
20428,EK BAAT KAHUN ,GOLMAAL ,LATA MANGESHKAR 
20429,EK BAGIYAN MEIN ,SAPNAY ,CHITHRA,SHANKAR 
20430,EK BANJARA GAAYE ,JEENE KI RAAH ,MOHD. RAFI 
20431,EK BATA DO ,KALICHARAN ,ANURADHA,KANCHAN 
20432,EK DAAL PAR TOTA BOLE ,CHOR MACHAYE SHOR ,MOHD. RAFI, LATA 
20433,EK DIN SAPNE MAI ,GOLMAAL ,KISHORE KUMAR 
20434,EK DIN TERA DHEERE SE ,GURUDEV ,AMIT KUMAR 
20435,EK DUKHIYARI KAHE ,RAM TERI GANGA MAILI ,LATA MANGESHKAR 
20436,EK GHAGRA ,KURUKSHETRA ,SUNIDHI CHAUHAN 
20437,EK GHAR BANAUNGA ,TERE GHAR KE SAAMNE ,LATA, MOHD. RAFI 
20438,EK HASEEN SHAAM KO ,DULHAN EK RAAT KI ,MOHD. RAFI 
20439,EK HASEENA THI ,KARZ ,KISHORE KUMAR 
20440,EK LADKI BHEEGI ,CHALTI KA NAAM GAADI ,KISHORE KUMAR 
20441,EK LADKI KI TUMHE ,MERE YAAR KI SHAADI HAI ,UDIT NARAYAN, ALKA YAGNIK 
20442,EK LADKI KO DEKHA TO AISA LAGA ,1942 A LOVE STORY ,KUMAR SANU 
20443,EK MAIN AUR EK TU ,DAAYRA(1997) ,HARIHARAN,JASBINDER KAUR 
20444,EK MAIN AUR EK TU ,KHEL KHEL MEIN ,ASHA, KISHORE KUMAR 
20445,EK NAZAR MEIN BHI ,TAXI NO. 211 ,K.K., SUNIDHI CHAUHAN 
20446,EK PYAR KA NAGMA HAI ,SHOR ,LATA MANGESHKAR, MUKESH 
20447,EK RADHA EK MEERA ,RAM TERI GANGA MAILI ,LATA MANGESHKAR 
20448,EK RASTA AAHA AAHA ,RAAM BALRAAM ,KISHORE, MOHD.RAFI 
20449,EK ROZ MAIN TADAPKAR ,BEMISAAL ,KISHORE KUMAR 
20450,EK SHAHENSHAH NE ,LEADER ,LATA,MOHD. RAFI 
20451,EK TAARA BOLE ,YAADGAR ,MAHENDRA KAPOOR 
20452,EK TARAF HUM TUM ,ANDHA KAANOON ,ASHA BHOSLE,S.P.B. 
20453,EK TERA SAATH HUMKO ,WAPAS ,LATA,MOHD. RAFI 
20454,EK THA GUL ,JAB JAB PHOOL KHILE ,MOHD. RAFI 
